{
  "key": "labWave",
  "derivedFrom": null,
  "loop": true,
  "duration": 48,
  "easing": "linear",
  "note": "An original raised-hand wave authored directly on SVGLab's fighter rig.",
  "poses": [
    {
      "torso": {
        "rotation": 0
      },
      "arm-front": {
        "rotation": 0
      },
      "forearm-front": {
        "rotation": 0
      }
    },
    {
      "torso": {
        "rotation": -1
      },
      "arm-front": {
        "rotation": -52.5
      },
      "forearm-front": {
        "rotation": -15
      }
    },
    {
      "torso": {
        "rotation": -2
      },
      "arm-front": {
        "rotation": -105
      },
      "forearm-front": {
        "rotation": -30
      }
    },
    {
      "torso": {
        "rotation": -2
      },
      "arm-front": {
        "rotation": -110
      },
      "forearm-front": {
        "rotation": -2.5
      }
    },
    {
      "torso": {
        "rotation": -2
      },
      "arm-front": {
        "rotation": -115
      },
      "forearm-front": {
        "rotation": 25
      }
    },
    {
      "torso": {
        "rotation": -2
      },
      "arm-front": {
        "rotation": -110
      },
      "forearm-front": {
        "rotation": 0
      }
    },
    {
      "torso": {
        "rotation": -2
      },
      "arm-front": {
        "rotation": -105
      },
      "forearm-front": {
        "rotation": -25
      }
    },
    {
      "torso": {
        "rotation": -2
      },
      "arm-front": {
        "rotation": -110
      },
      "forearm-front": {
        "rotation": 0
      }
    },
    {
      "torso": {
        "rotation": -2
      },
      "arm-front": {
        "rotation": -115
      },
      "forearm-front": {
        "rotation": 25
      }
    },
    {
      "torso": {
        "rotation": -2
      },
      "arm-front": {
        "rotation": -110
      },
      "forearm-front": {
        "rotation": 0
      }
    },
    {
      "torso": {
        "rotation": -2
      },
      "arm-front": {
        "rotation": -105
      },
      "forearm-front": {
        "rotation": -25
      }
    },
    {
      "torso": {
        "rotation": -1
      },
      "arm-front": {
        "rotation": -52.5
      },
      "forearm-front": {
        "rotation": -12.5
      }
    },
    {
      "torso": {
        "rotation": 0
      },
      "arm-front": {
        "rotation": 0
      },
      "forearm-front": {
        "rotation": 0
      }
    }
  ]
}
