{
  "key": "labOverhead",
  "derivedFrom": null,
  "loop": false,
  "duration": 30,
  "easing": "linear",
  "note": "Original two-hand overhead arc timed to the tech contact window.",
  "poses": [
    {"torso":{"rotation":0},"head":{"rotation":0},"arm-front":{"rotation":-24},"forearm-front":{"rotation":-55},"arm-back":{"rotation":-28},"forearm-back":{"rotation":-45},"leg-front":{"rotation":0},"shin-front":{"rotation":0},"leg-back":{"rotation":0},"shin-back":{"rotation":0},"pelvis":{"y":0}},
    {"torso":{"rotation":-4.0},"head":{"rotation":-2.5},"arm-front":{"rotation":-49.0},"forearm-front":{"rotation":-55.5},"arm-back":{"rotation":-52.0},"forearm-back":{"rotation":-48.5},"leg-front":{"rotation":-2.0},"shin-front":{"rotation":2.0},"leg-back":{"rotation":1.5},"shin-back":{"rotation":-1.5},"pelvis":{"y":0.0}},
    {"torso":{"rotation":-8},"head":{"rotation":-5},"arm-front":{"rotation":-74},"forearm-front":{"rotation":-56},"arm-back":{"rotation":-76},"forearm-back":{"rotation":-52},"leg-front":{"rotation":-4},"shin-front":{"rotation":4},"leg-back":{"rotation":3},"shin-back":{"rotation":-3},"pelvis":{"y":0}},
    {"torso":{"rotation":-12.5},"head":{"rotation":-8.0},"arm-front":{"rotation":-98.0},"forearm-front":{"rotation":-38.0},"arm-back":{"rotation":-98.0},"forearm-back":{"rotation":-35.0},"leg-front":{"rotation":-7.0},"shin-front":{"rotation":6.0},"leg-back":{"rotation":5.0},"shin-back":{"rotation":-5.0},"pelvis":{"y":-1.5}},
    {"torso":{"rotation":-17},"head":{"rotation":-11},"arm-front":{"rotation":-122},"forearm-front":{"rotation":-20},"arm-back":{"rotation":-120},"forearm-back":{"rotation":-18},"leg-front":{"rotation":-10},"shin-front":{"rotation":8},"leg-back":{"rotation":7},"shin-back":{"rotation":-7},"pelvis":{"y":-3}},
    {"torso":{"rotation":-17.5},"head":{"rotation":-11.5},"arm-front":{"rotation":-129.5},"forearm-front":{"rotation":-14.0},"arm-back":{"rotation":-127.5},"forearm-back":{"rotation":-12.5},"leg-front":{"rotation":-12.0},"shin-front":{"rotation":10.0},"leg-back":{"rotation":8.0},"shin-back":{"rotation":-7.5},"pelvis":{"y":-3.5}},
    {"torso":{"rotation":-18},"head":{"rotation":-12},"arm-front":{"rotation":-137},"forearm-front":{"rotation":-8},"arm-back":{"rotation":-135},"forearm-back":{"rotation":-7},"leg-front":{"rotation":-14},"shin-front":{"rotation":12},"leg-back":{"rotation":9},"shin-back":{"rotation":-8},"pelvis":{"y":-4}},
    {"torso":{"rotation":1.0},"head":{"rotation":-1.0},"arm-front":{"rotation":-58.5},"forearm-front":{"rotation":-16.0},"arm-back":{"rotation":-59.5},"forearm-back":{"rotation":-17.0},"leg-front":{"rotation":1.0},"shin-front":{"rotation":3.0},"leg-back":{"rotation":-1.5},"shin-back":{"rotation":0.5},"pelvis":{"y":-0.5}},
    {"torso":{"rotation":20},"head":{"rotation":10},"arm-front":{"rotation":20},"forearm-front":{"rotation":-24},"arm-back":{"rotation":16},"forearm-back":{"rotation":-27},"leg-front":{"rotation":16},"shin-front":{"rotation":-6},"leg-back":{"rotation":-12},"shin-back":{"rotation":9},"pelvis":{"y":3}},
    {"torso":{"rotation":12.5},"head":{"rotation":6.0},"arm-front":{"rotation":0.0},"forearm-front":{"rotation":-34.5},"arm-back":{"rotation":-5.0},"forearm-back":{"rotation":-36.5},"leg-front":{"rotation":12.0},"shin-front":{"rotation":-4.0},"leg-back":{"rotation":-8.5},"shin-back":{"rotation":6.5},"pelvis":{"y":2.0}},
    {"torso":{"rotation":5},"head":{"rotation":2},"arm-front":{"rotation":-20},"forearm-front":{"rotation":-45},"arm-back":{"rotation":-26},"forearm-back":{"rotation":-46},"leg-front":{"rotation":8},"shin-front":{"rotation":-2},"leg-back":{"rotation":-5},"shin-back":{"rotation":4},"pelvis":{"y":1}},
    {"torso":{"rotation":2.5},"head":{"rotation":1.0},"arm-front":{"rotation":-22.0},"forearm-front":{"rotation":-50.0},"arm-back":{"rotation":-27.0},"forearm-back":{"rotation":-45.5},"leg-front":{"rotation":4.0},"shin-front":{"rotation":-1.0},"leg-back":{"rotation":-2.5},"shin-back":{"rotation":2.0},"pelvis":{"y":0.5}},
    {"torso":{"rotation":0},"head":{"rotation":0},"arm-front":{"rotation":-24},"forearm-front":{"rotation":-55},"arm-back":{"rotation":-28},"forearm-back":{"rotation":-45},"leg-front":{"rotation":0},"shin-front":{"rotation":0},"leg-back":{"rotation":0},"shin-back":{"rotation":0},"pelvis":{"y":0}}
  ]
}
